{
  "format_version": 1,
  "id": "ui-prefab://orbit/slot",
  "parameters": {
    "accent": {
      "type": "string",
      "default": "#FFB66B"
    },
    "action": {
      "type": "string",
      "default": ""
    },
    "disabled": {
      "type": "boolean",
      "default": false
    },
    "label": {
      "type": "string",
      "default": "01"
    },
    "raised": {
      "type": "string",
      "default": "#263748"
    },
    "size": {
      "type": "array",
      "default": [
        64,
        64
      ]
    },
    "stroke": {
      "type": "string",
      "default": "#3B5166"
    },
    "text": {
      "type": "string",
      "default": "#EEF4FA"
    }
  },
  "root": {
    "id": "control",
    "type": "button",
    "size": "${size}",
    "text": "${label}",
    "action": "${action}",
    "disabled": "${disabled}",
    "corner_radius": 10,
    "font_size": 15,
    "text_color": "${text}",
    "background_color": "${raised}",
    "hover_color": "${stroke}",
    "border_color": "${stroke}",
    "border_width": 1,
    "color": "${accent}"
  }
}
